{
  "schema_version": "1.1.0",
  "page_id": "movement.front",
  "page_type": "practice_front",
  "title": "Movement",
  "subtitle": "Practices for Activation & Discharge",

  "edition": {
    "number": 1,
    "name": "Orientation",
    "series": "Ego Hygiene Magazine"
  },

  "intent": {
    "role": "somatic_activation_pillar",
    "primary_function": "discharge_accumulated_tension_through_movement",
    "secondary_function": "restore_body_mind_integration",
    "tone": ["activating", "grounded", "embodied", "non-performative"]
  },

  "visual_style": {
    "world": "retro_mystic_field_manual",
    "aesthetic_reference": "mid_20th_century_pulp_print_artifact",
    "texture": ["aged_paper", "worn_ink", "organic_grain"],
    "color_palette": {
      "primary": ["deep_amber", "burnt_red"],
      "secondary": ["muted_teal", "earth_brown"],
      "accent": ["soft_gold_glow"]
    },
    "iconography": ["running_silhouette", "concentric_rings", "lightning_bolt"],
    "typography": {
      "title": {
        "style": "bold_distressed_retro_display",
        "case": "uppercase",
        "texture": "ink_wear",
        "hierarchy_rank": 1
      },
      "body": {
        "style": "legible_serif",
        "contrast": "high",
        "print_safe": true
      }
    }
  },

  "layout": {
    "composition": "central_figure_with_surrounding_instruction_panels",
    "central_element": "running_silhouette",
    "depth_layers": 2,
    "flow": "clockwise_loop",
    "panel_style": {
      "shape": "rounded_rectangle",
      "has_speech_tail": false,
      "appearance": "printed_instructional_panel"
    }
  },

  "practice_panels": [
    {
      "id": "start",
      "label": "START",
      "text": "Begin with any movement—a walk, a stretch, or a shake.",
      "domain": "somatic",
      "modality": "physical"
    },
    {
      "id": "breathe",
      "label": "BREATHE",
      "text": "Coordinate breath with movement to synchronize body and mind.",
      "domain": "somatic",
      "modality": "breathwork"
    },
    {
      "id": "discharge",
      "label": "DISCHARGE",
      "text": "Let intensity build and release naturally—no performance needed.",
      "domain": "autonomic",
      "modality": "release"
    },
    {
      "id": "settle",
      "label": "SETTLE",
      "text": "Slow down and notice the shift in your baseline.",
      "domain": "interoceptive",
      "modality": "awareness"
    }
  ],

  "effect_section": {
    "label": "EFFECT",
    "text": "Reduces cortisol, activates endorphins, and restores regulatory baseline.",
    "scientific_status": "conceptual_placeholder",
    "visual_reference": "brain_icon"
  },

  "footer_banner": {
    "text": "ANY MOVEMENT COUNTS. YOUR SYSTEM RESPONDS.",
    "tone": "reassuring",
    "intent": "lower_barrier_to_entry"
  },

  "asset_files": {
    "master_image": "movement.front.page.png",
    "print_variant": "variants/movement.front.print.png",
    "animation": "movement.front.animation.mp4",
    "prompt": "movement.front.prompt"
  },

  "image_metadata": {
    "format": "PNG",
    "color_mode": "RGB",
    "dimensions_px": {
      "width": 1024,
      "height": 1536
    },
    "aspect_ratio": "2:3",
    "orientation": "portrait",
    "intended_print_dpi": 300,
    "print_safe_dimensions_at_300dpi_inches": {
      "width": 3.41,
      "height": 5.12
    },
    "file_size_bytes": 0,
    "color_profile": "sRGB (assumed)",
    "compression": "lossless_png"
  },

  "animation_profile": {
    "type": "practice_animation",
    "allowed_effects": [
      "ambient_particle_drift",
      "grain_breathing",
      "subtle_figure_pulse"
    ],
    "forbidden_effects": [
      "camera_movement",
      "zoom",
      "parallax",
      "text_movement",
      "modern_digital_cleaning"
    ]
  },

  "print_considerations": {
    "requires_upscale_for_large_format": true,
    "recommended_upscale_factor": "2x",
    "max_safe_print_size_inches_at_native": {
      "width": 3.4,
      "height": 5.1
    }
  },

  "constraints": {
    "no_fitness_culture_aesthetic": true,
    "no_performance_pressure": true,
    "no_medical_claims": true,
    "preserve_pulp_texture": true
  },

  "notes": {
    "movement_as_regulation_not_exercise": true,
    "pairs_with_rest_practice": true
  }
}
